<?xml version="1.0" encoding="UTF-8"?>
<!DOCTYPE project-record SYSTEM "C:\Users\Lobarinhas\Desktop\UM\DesvolvimentoWebApp\DWeb2019\trab6\pr.dtd">
<project-record>
    <header>
        <keyname>TP5-DWeb2019</keyname>
        <title>TPC6: Aplicação Web de gestão do Arquivo Sonoro de Ernesto Veiga de Oliveira</title>
        <subtitle></subtitle>
        <begin-date>06/11/2019</begin-date>
        <end-date>07/11/2019</end-date>
        <supervisor url="http://www4.di.uminho.pt/~jcr">
            José Carlos Ramalho
        </supervisor>
    </header>
    <workTeam>
        <element>
            <number>PG41845</number>
            <name>João Lobarinhas Fernandes Miranda</name>
            <email url="pg41845@alunos.uminho.pt">pg41845@alunos.uminho.pt</email>
        </element>
    </workTeam>
    <abstract>
        <text>
            Converter o ficheiro "arq-son-EVO.xml" para o formato json.
        </text>
        <text>
            Criar uma aplicação web com todas as operações do CRUD
        </text>
    </abstract>
    <deliverables>
        <deliverable url="pr.xml">
            Ficheiro XML do Porject Record.
        </deliverable>
        <deliverable url="pr.dtd">
            DTD do Project Record.
        </deliverable>
        <deliverable url="arqson">
            Pasta onde guarda os ficheiros referentes a este tpc.
        </deliverable>
        <deliverable url="arqson/server.js">
            Ficheiro javascript que permite iniciar o servidor.
        </deliverable>
    </deliverables>
    <footer>
        07/11/2019
    </footer>
</project-record>
