<?xml version="1.0" encoding="UTF-8"?>
<!DOCTYPE project-record SYSTEM "C:\Users\Lobarinhas\Desktop\UM\DesvolvimentoWebApp\DWeb2019\trab8\pr.dtd">
<project-record>
    <header>
        <keyname>TP8-DWeb2019</keyname>
        <title>TPC8: Exercício Nº 1: Prémios Nobel</title>
        <subtitle></subtitle>
        <begin-date>13/11/2019</begin-date>
        <end-date>13/11/2019</end-date>
        <supervisor url="http://www4.di.uminho.pt/~jcr">
            José Carlos Ramalho
        </supervisor>
    </header>
    <workTeam>
        <element>
            <number>PG41845</number>
            <name>João Lobarinhas Fernandes Miranda</name>
            <email url="pg41845@alunos.uminho.pt">pg41845@alunos.uminho.pt</email>
        </element>
    </workTeam>
    <abstract>
        <text>
            Converter o dataset disponibilizado nos recursos para um formato à tua escolha, ou usá-lo como está (há vários conversores online de XML para JSON e outros formatos), e colocá-lo no sistema que usarás para assegurar a sua persistência: ficheiro, MongoDB, json-server, etc; 
        </text>
        <text>
            Criar um servidor nodejs que dê suporte à um API de Dados
        </text>
    </abstract>
    <deliverables>
        <deliverable url="pr.xml">
            Ficheiro XML do Porject Record.
        </deliverable>
        <deliverable url="pr.dtd">
            DTD do Project Record.
        </deliverable>
        <deliverable url="nobel">
            Pasta onde guarda os ficheiros referentes a este tpc.
        </deliverable>
        <deliverable url="prize.json">
            Ficheiro json a ser importado para a base de dados MongoDB.
        </deliverable>
        <deliverable url="nobel/server.js">
            Ficheiro javascript que permite iniciar o servidor.
        </deliverable>
        <deliverable url="nobel/controllers/nobel.js">
            Ficheiro javascript que funciona como controlador do modelo.
        </deliverable>
        <deliverable url="nobel/model/nobel.js">
            Ficheiro javascript que foi criado com base na estrutura de dados já existe na base de dados, para que
            funcione como modelo.
        </deliverable>
        <deliverable url="nobel/routes/api.js">
            Ficheiro javascript que funciona trata dos pedidos recebidos por parte do cliente.
        </deliverable>
    </deliverables>
    <footer>
        10/11/2019
    </footer>
</project-record>
